{
  "apiVersion": "researchos.dev/v0alpha1",
  "kind": "ModelFixture",
  "id": "m1-checkpoint-proposal",
  "prompt": {
    "role": "user",
    "task": "propose-revision",
    "token": "M1_CHECKPOINT_PROMPT_TOKEN"
  },
  "output": {
    "apiVersion": "researchos.dev/v0alpha1",
    "kind": "ProposalSubmitRequest",
    "projectId": "example-minimal",
    "experimentRevision": 1,
    "source": "https://researchos.dev/projects/example-minimal",
    "subject": "proposal.revise-eval",
    "streamid": "stream.research",
    "actor": {
      "id": "mock.deterministic",
      "kind": "ai",
      "modelId": "mock.deterministic.v1"
    },
    "event": {
      "id": "evt.proposal.1",
      "time": "2026-09-07T12:00:02Z"
    },
    "proposalId": "proposal.revise-eval",
    "specDiffDigest": "jcs-sha256:1ed2abbfa0789302d7dc2a6d94c5c41c68856b10e5555e47283f9c0c049f50d2",
    "proposedSpecDigest": "jcs-sha256:3aef52d942c807c1661ea3e10e856b74b7b209e7f7a8a92c47cd183fcb045af0",
    "rationale": "Tighten the evaluation split.",
    "predictions": [
      {
        "id": "pred.1",
        "statement": "Held-out loss decreases.",
        "expectedDirection": "decrease"
      }
    ],
    "falsificationConditions": [
      "Held-out loss does not decrease."
    ],
    "riskAssessment": {
      "data": "",
      "method": "split change",
      "safety": "",
      "cost": ""
    },
    "evidenceRefs": []
  }
}
